"column_name","description"
"study_id","personal study ID composed by the first authors’ first surname_year of publication_first title word "
"experiment","number of experiment from publication "
"experiment_name","name of data subset – can include different experiments within data set/ different training conditions/ pre-test data/ etc "
"participant","name of the participant "
"sex","sex of the participant "
"role","role of the participant – mother "
"participant_2","name of the participant_2 "
"sex_2","sex of the participan_2 "
"role_2","role of the participant_2 – child  "
"species","species of individuals participating in the study - orangutan "
"dyad","name of the two participants that compose the dyad "
"session","set of trials - mostly occurring on the same day - usually numerical "
"trial_number","presentation of the experiment to the participants - usually numerical "
"condition","condition presented – tube"
"baiting_room","the room in which the food was baited"
"tool_given","location in which the tool was given to the mother"
"tool_inserted_by","identity of the individual that used the tool ( I for individual) "
"2_reward_retrieved_by","identify of the individual that retrieved the rewards in room 2 (m for mother)"
"4_reward_retrieved_by","identity of the individual that retrieved the rewards in room 4 (I for individual)"
"2_reward_eaten_by","identity of the individual that ate the food rewards released in room 2"
"4_reward_eaten_by","identity of the individual that ate the food rewards released in room 4"
"tool_transfer_by_mother","whether the mother actively or passively transferred the tool to the juvenile"
"social_tool","whether there were instances of social tool"
"location_of_infant_when_mother_received_tool","location of the infant when the mother received the tool at the beginning of the trial"
